id;name;description;technology;hours_to_study;rating;level;learning_path;total_modules;registered_students
14;Belajar Fundamental Aplikasi Android;"<p>Android merupakan sistem operasi mobile dengan pengguna terbesar di Indonesia, yakni sekitar 90%. Karena itulah banyak perusahaan yang membuat versi Android-nya supaya lebih dekat dengan pelanggannya, seperti Youtube, Facebook, dan Twitter. Perusahaan kecil pun turut membutuhkan aplikasi Android untuk menyelesaikan masalah yang ada. Ini juga menandakan bahwa kebutuhan akan Android developer semakin meningkat. Tak heran, profesi Android developer merupakan 1 dari 5 profesi yang paling diincar perusahaan.</p><ul><li>Sebagian besar masyarakat Indonesia memiliki handphone dengan Android sebagai sistem operasinya, ini merupakan potensi yang besar.</li><li>Android terbukti menjadi solusi untuk permasalahan yang ada di masyarakat, sehingga bisa bermanfaat lebih luas.</li><li>Banyak perusahaan yang membutuhkan Android Developer namun resource yang ada masih sangat sedikit, bahkan dinyatakan darurat.</li><li>Menjadi Android Developer merupakan salah satu pekerjaan yang bisa dilakukan secara freelance, sehingga waktunya bisa lebih fleksibel.</li><li>Android memiliki potensi yang besar untuk menghasilkan uang, seperti melalui iklan Admob, In-App purchase dan membuat proyek aplikasi.</li></ul><p><br></p><h4><span style=""font-size: 30px>Target dan Sasaran Siswa</span></h4><ul><li>Kelas ditujukan bagi developer yang ingin belajar fundamental pembuatan aplikasi Android, seperti networking dan database, dengan mengacu pada standar kompetensi internasional milik Google Developers Authorized Training Partner.</li><li>Kelas dapat diikuti oleh siswa yang melek IT sehingga wajib memiliki dan dapat mengoperasikan komputer dengan baik.</li><li>Kelas ini didesain untuk siswa yang memiliki latar belakang dan pemahaman mengenai pemrograman menggunakan Kotlin atau Java.</li><li>Siswa harus bisa belajar mandiri, berkomitmen, benar-benar punya rasa ingin tahu, dan tertarik pada subjek materi, karena sebaik apa pun materi kelas ini, tidak akan berguna tanpa keseriusan siswa untuk belajar, berlatih, dan mencoba.</li><li>Di akhir kelas, siswa dapat membuat aplikasi yang dapat mengambil data dari Web API dan menyimpan data favorit menggunakan database lokal.</li></ul><p><a href=""https://developers.google.com/training/programs/indonesia/?hl=id""></a></p>";Android;140;4.84;PROFESSIONAL;Android Developer;107;41782
51;Belajar Membuat Aplikasi Android untuk Pemula;"<p>Android merupakan sistem operasi mobile dengan pengguna terbesar di Indonesia, yakni sekitar 90%. Karena itulah banyak perusahaan yang membuat versi Android-nya supaya lebih dekat dengan pelanggannya, seperti Youtube, Facebook, dan Twitter. Perusahaan kecil pun turut membutuhkan aplikasi Android untuk menyelesaikan masalah yang ada. Ini juga menandakan bahwa kebutuhan akan Android developer semakin meningkat. Tak heran, profesi Android developer merupakan 1 dari 5 profesi yang paling diincar perusahaan.</p><ul><li>Sebagian besar masyarakat Indonesia memiliki handphone dengan Android sebagai sistem operasinya, ini merupakan potensi yang besar.</li><li>Android terbukti menjadi solusi untuk permasalahan yang ada di masyarakat, sehingga bisa bermanfaat lebih luas.</li><li>Banyak perusahaan yang membutuhkan Android Developer namun resource yang ada masih sangat sedikit, bahkan dinyatakan darurat.</li><li>Menjadi Android Developer merupakan salah satu pekerjaan yang bisa dilakukan secara freelance, sehingga waktunya bisa lebih fleksibel.</li><li>Android memiliki potensi yang besar untuk menghasilkan uang, seperti melalui iklan Admob, In-App purchase dan membuat proyek aplikasi.</li></ul><h4><span style=""font-size: 30px>Target dan Sasaran Siswa</span></h4><ul><li>Kelas ini ditujukan bagi pemula yang ingin memulai karirnya di bidang Android Developer dengan mengacu pada standar kompetensi internasional milik Google.</li><li>Kelas dapat diikuti oleh siswa yang melek IT sehingga wajib memiliki dan dapat mengoperasikan komputer dengan baik.</li><li>Kelas ini didesain untuk siswa yang memiliki latar belakang dan pemahaman mengenai pemrograman menggunakan Kotlin atau Java.</li><li>Siswa harus bisa belajar mandiri, berkomitmen, benar-benar punya rasa ingin tahu, dan tertarik pada subjek materi, karena sebaik apa pun materi kelas ini, tidak akan berguna tanpa keseriusan siswa untuk belajar, berlatih, dan mencoba.</li><li>Di akhir kelas, siswa dapat membuat aplikasi Android yang dapat menampilkan list dan detail data.</li></ul>";Android;60;4.87;BEGINNER;Android Developer;49;116208
60;Memulai Pemrograman Dengan Java;"<p><span data-sheets-textstyleruns=""î¸î¸î¸î¸î¸î¸"" data-sheets-userformat='{""2"":13185,""3"":{""1"":0},""10"":0,""11"":4,""12"":0,""15"":""Arial"",""16"":9}' data-sheets-value='{""1"":2,""2"":""Java merupakan bahasa yang diciptakan oleh James Gosling di tahun 1990-an. Java muncul sebagai bahasa yang dapat dijalankan di berbagai platform tanpa perlu re-kompilasi. Berdasarkan TIOBE Programming Community Index, Java masih merupakan salah satu bahasa pemrograman terpopuler di dunia. Oracle menyatakan 90% perusahaan terkemuka pada daftar Fortune 500 pernah menggunakan bahasa Java. Selain itu, Java juga dapat digunakan untuk mengembangkan aplikasi pada platform desktop, web, mobile, embedded, dan IoT.""}'>Java merupakan bahasa yang diciptakan oleh James Gosling di tahun 1990-an. Java muncul sebagai bahasa yang dapat dijalankan di berbagai platform tanpa perlu re-kompilasi. Berdasarkan TIOBE Programming Community Index, Java masih merupakan salah satu bahasa pemrograman terpopuler di dunia. Oracle menyatakan 90% perusahaan terkemuka pada daftar Fortune 500 pernah menggunakan bahasa Java. Selain itu, Java juga dapat digunakan untuk mengembangkan aplikasi pada platform desktop, web, mobile, embedded, dan IoT.</span><span data-sheets-userformat='{""2"":13185,""3"":{""1"":0},""10"":0,""11"":4,""12"":0,""15"":""Arial"",""16"":9}' data-sheets-value='{""1"":2,""2"":""Bahasa C adalah bahasa prosedural yang memiliki banyak kegunaan. Ia didesain untuk di-compile secara sederhana agar mendukung akses ke low-level memory, pendukung bahasa dalam instruksi mesin. Meskipun didesain secara minimal, C bisa digunakan sebagai bahasa multi-platform. Menurut GitHub, C adalah 1 dari 10 bahasa pemrogramman terbaik. Bahasa C sangatlah cocok bagi Anda yang ingin masuk ke dunia programming. Oleh karena itu, bahasa C sering digunakan sebagai bahasa pertama untuk belajar pemrograman. ""}'></span></p><ul><li><span data-sheets-textstyleruns='{""1"":0}î¸[null,47,{}]î¸{""1"":53}î¸[null,574,{}]î¸{""1"":584}î¸[null,604,{}]î¸{""1"":614}' data-sheets-userformat='{""2"":15233,""3"":{""1"":0},""10"":0,""11"":4,""12"":0,""14"":[null,2,0],""15"":""Arial"",""16"":9}' data-sheets-value='{""1"":2,""2"":""- Bahasa Java merupakan bahasa terpopuler yang pernah digunakan oleh 90% perusahaan ternama.\n- Dengan bahasa Java, Anda dapat mengembangkan aplikasi untuk platform desktop, web, mobile, hingga embedded dan IoT.\n- Siapa pun Anda, jika ingin menjadi Java Developer harus memiliki pengetahuan dasar pemrograman Java seperti Java Dasar, Control Flow, Collection Type, dan Object-Oriented Programming.\n- Penggunaan bahasa Java itu gratis (open source), sehingga siapa saja dapat mempelajari dan menggunakannya.\n- Berdasarkan TIOBE Programming Community Index, Java masih menjadi salah satu bahasa pemrograman terpopuler di dunia. ""}'>Bahasa Java merupakan bahasa terpopuler yang pernah digunakan oleh 90% perusahaan ternama.</span></li><li><span data-sheets-textstyleruns='{""1"":0}î¸[null,47,{}]î¸{""1"":53}î¸[null,574,{}]î¸{""1"":584}î¸[null,604,{}]î¸{""1"":614}' data-sheets-userformat='{""2"":15233,""3"":{""1"":0},""10"":0,""11"":4,""12"":0,""14"":[null,2,0],""15"":""Arial"",""16"":9}' data-sheets-value='{""1"":2,""2"":""- Bahasa Java merupakan bahasa terpopuler yang pernah digunakan oleh 90% perusahaan ternama.\n- Dengan bahasa Java, Anda dapat mengembangkan aplikasi untuk platform desktop, web, mobile, hingga embedded dan IoT.\n- Siapa pun Anda, jika ingin menjadi Java Developer harus memiliki pengetahuan dasar pemrograman Java seperti Java Dasar, Control Flow, Collection Type, dan Object-Oriented Programming.\n- Penggunaan bahasa Java itu gratis (open source), sehingga siapa saja dapat mempelajari dan menggunakannya.\n- Berdasarkan TIOBE Programming Community Index, Java masih menjadi salah satu bahasa pemrograman terpopuler di dunia. ""}'>Dengan bahasa Java, Anda dapat mengembangkan aplikasi untuk platform desktop, web, mobile, hingga embedded dan IoT.</span></li><li><span data-sheets-textstyleruns='{""1"":0}î¸[null,47,{}]î¸{""1"":53}î¸[null,574,{}]î¸{""1"":584}î¸[null,604,{}]î¸{""1"":614}' data-sheets-userformat='{""2"":15233,""3"":{""1"":0},""10"":0,""11"":4,""12"":0,""14"":[null,2,0],""15"":""Arial"",""16"":9}' data-sheets-value='{""1"":2,""2"":""- Bahasa Java merupakan bahasa terpopuler yang pernah digunakan oleh 90% perusahaan ternama.\n- Dengan bahasa Java, Anda dapat mengembangkan aplikasi untuk platform desktop, web, mobile, hingga embedded dan IoT.\n- Siapa pun Anda, jika ingin menjadi Java Developer harus memiliki pengetahuan dasar pemrograman Java seperti Java Dasar, Control Flow, Collection Type, dan Object-Oriented Programming.\n- Penggunaan bahasa Java itu gratis (open source), sehingga siapa saja dapat mempelajari dan menggunakannya.\n- Berdasarkan TIOBE Programming Community Index, Java masih menjadi salah satu bahasa pemrograman terpopuler di dunia. ""}'>Siapa pun Anda, jika ingin menjadi Java Developer harus memiliki pengetahuan dasar pemrograman Java seperti Java Dasar, Control Flow, Collection Type, dan Object-Oriented Programming.</span></li><li><span data-sheets-textstyleruns='{""1"":0}î¸[null,47,{}]î¸{""1"":53}î¸[null,574,{}]î¸{""1"":584}î¸[null,604,{}]î¸{""1"":614}' data-sheets-userformat='{""2"":15233,""3"":{""1"":0},""10"":0,""11"":4,""12"":0,""14"":[null,2,0],""15"":""Arial"",""16"":9}' data-sheets-value='{""1"":2,""2"":""- Bahasa Java merupakan bahasa terpopuler yang pernah digunakan oleh 90% perusahaan ternama.\n- Dengan bahasa Java, Anda dapat mengembangkan aplikasi untuk platform desktop, web, mobile, hingga embedded dan IoT.\n- Siapa pun Anda, jika ingin menjadi Java Developer harus memiliki pengetahuan dasar pemrograman Java seperti Java Dasar, Control Flow, Collection Type, dan Object-Oriented Programming.\n- Penggunaan bahasa Java itu gratis (open source), sehingga siapa saja dapat mempelajari dan menggunakannya.\n- Berdasarkan TIOBE Programming Community Index, Java masih menjadi salah satu bahasa pemrograman terpopuler di dunia. ""}'>Penggunaan bahasa Java itu gratis (open source), sehingga siapa saja dapat mempelajari dan menggunakannya.</span></li><li><span data-sheets-textstyleruns='{""1"":0}î¸[null,47,{}]î¸{""1"":53}î¸[null,574,{}]î¸{""1"":584}î¸[null,604,{}]î¸{""1"":614}' data-sheets-userformat='{""2"":15233,""3"":{""1"":0},""10"":0,""11"":4,""12"":0,""14"":[null,2,0],""15"":""Arial"",""16"":9}' data-sheets-value='{""1"":2,""2"":""- Bahasa Java merupakan bahasa terpopuler yang pernah digunakan oleh 90% perusahaan ternama.\n- Dengan bahasa Java, Anda dapat mengembangkan aplikasi untuk platform desktop, web, mobile, hingga embedded dan IoT.\n- Siapa pun Anda, jika ingin menjadi Java Developer harus memiliki pengetahuan dasar pemrograman Java seperti Java Dasar, Control Flow, Collection Type, dan Object-Oriented Programming.\n- Penggunaan bahasa Java itu gratis (open source), sehingga siapa saja dapat mempelajari dan menggunakannya.\n- Berdasarkan TIOBE Programming Community Index, Java masih menjadi salah satu bahasa pemrograman terpopuler di dunia. ""}'>Berdasarkan TIOBE Programming Community Index, Java masih menjadi salah satu bahasa pemrograman terpopuler di dunia.</span></li></ul><p><br></p><h4><span style=""font-size: 30px>Target dan Sasaran Siswa</span></h4><ul><li><span data-sheets-textstyleruns=""î¸î¸"" data-sheets-userformat='{""2"":13185,""3"":{""1"":0},""10"":0,""11"":4,""12"":0,""15"":""Arial"",""16"":9}' data-sheets-value='{""1"":2,""2"":""Target dan Sasaran Siswa\n- Kelas ini ditujukan untuk pemula yang ingin mempelajari dasar pemrograman bahasa Java dengan mengacu pada standar industri.\n- Kelas dapat diikuti oleh siswa yang melek IT sehingga wajib memiliki dan dapat mengoperasikan komputer dengan baik.\n- Kelas ini didesain untuk pemula sehingga tidak ada prasyarat dalam pemahaman pemrograman sebelumnya. Namun, akan lebih baik jika memiliki pengetahuan dasar tentang pemrograman.\n- Siswa harus bisa belajar mandiri, berkomitmen, benar-benar punya rasa ingin tahu, dan tertarik pada subjek materi, karena sebaik apa pun materi kelas ini, tidak akan berguna tanpa keseriusan siswa untuk belajar, berlatih, dan mencoba.\n- Di akhir kelas, siswa dapat membuat program Java dengan menggunakan IDE Intellij Idea atau IDE Online seperti Glot.io atau Replit.""}'>Kelas ini ditujukan untuk pemula yang ingin mempelajari dasar pemrograman bahasa Java dengan mengacu pada standar industri.</span></li><li><span data-sheets-textstyleruns=""î¸î¸"" data-sheets-userformat='{""2"":13185,""3"":{""1"":0},""10"":0,""11"":4,""12"":0,""15"":""Arial"",""16"":9}' data-sheets-value='{""1"":2,""2"":""Target dan Sasaran Siswa\n- Kelas ini ditujukan untuk pemula yang ingin mempelajari dasar pemrograman bahasa Java dengan mengacu pada standar industri.\n- Kelas dapat diikuti oleh siswa yang melek IT sehingga wajib memiliki dan dapat mengoperasikan komputer dengan baik.\n- Kelas ini didesain untuk pemula sehingga tidak ada prasyarat dalam pemahaman pemrograman sebelumnya. Namun, akan lebih baik jika memiliki pengetahuan dasar tentang pemrograman.\n- Siswa harus bisa belajar mandiri, berkomitmen, benar-benar punya rasa ingin tahu, dan tertarik pada subjek materi, karena sebaik apa pun materi kelas ini, tidak akan berguna tanpa keseriusan siswa untuk belajar, berlatih, dan mencoba.\n- Di akhir kelas, siswa dapat membuat program Java dengan menggunakan IDE Intellij Idea atau IDE Online seperti Glot.io atau Replit.""}'>Kelas dapat diikuti oleh siswa yang melek IT sehingga wajib memiliki dan dapat mengoperasikan komputer dengan baik.</span></li><li><span data-sheets-textstyleruns=""î¸î¸"" data-sheets-userformat='{""2"":13185,""3"":{""1"":0},""10"":0,""11"":4,""12"":0,""15"":""Arial"",""16"":9}' data-sheets-value='{""1"":2,""2"":""Target dan Sasaran Siswa\n- Kelas ini ditujukan untuk pemula yang ingin mempelajari dasar pemrograman bahasa Java dengan mengacu pada standar industri.\n- Kelas dapat diikuti oleh siswa yang melek IT sehingga wajib memiliki dan dapat mengoperasikan komputer dengan baik.\n- Kelas ini didesain untuk pemula sehingga tidak ada prasyarat dalam pemahaman pemrograman sebelumnya. Namun, akan lebih baik jika memiliki pengetahuan dasar tentang pemrograman.\n- Siswa harus bisa belajar mandiri, berkomitmen, benar-benar punya rasa ingin tahu, dan tertarik pada subjek materi, karena sebaik apa pun materi kelas ini, tidak akan berguna tanpa keseriusan siswa untuk belajar, berlatih, dan mencoba.\n- Di akhir kelas, siswa dapat membuat program Java dengan menggunakan IDE Intellij Idea atau IDE Online seperti Glot.io atau Replit.""}'>Kelas ini didesain untuk pemula sehingga tidak ada prasyarat dalam pemahaman pemrograman sebelumnya. Namun, akan lebih baik jika memiliki pengetahuan dasar tentang pemrograman.</span></li><li><span data-sheets-textstyleruns=""î¸î¸"" data-sheets-userformat='{""2"":13185,""3"":{""1"":0},""10"":0,""11"":4,""12"":0,""15"":""Arial"",""16"":9}' data-sheets-value='{""1"":2,""2"":""Target dan Sasaran Siswa\n- Kelas ini ditujukan untuk pemula yang ingin mempelajari dasar pemrograman bahasa Java dengan mengacu pada standar industri.\n- Kelas dapat diikuti oleh siswa yang melek IT sehingga wajib memiliki dan dapat mengoperasikan komputer dengan baik.\n- Kelas ini didesain untuk pemula sehingga tidak ada prasyarat dalam pemahaman pemrograman sebelumnya. Namun, akan lebih baik jika memiliki pengetahuan dasar tentang pemrograman.\n- Siswa harus bisa belajar mandiri, berkomitmen, benar-benar punya rasa ingin tahu, dan tertarik pada subjek materi, karena sebaik apa pun materi kelas ini, tidak akan berguna tanpa keseriusan siswa untuk belajar, berlatih, dan mencoba.\n- Di akhir kelas, siswa dapat membuat program Java dengan menggunakan IDE Intellij Idea atau IDE Online seperti Glot.io atau Replit.""}'>Siswa harus bisa belajar mandiri, berkomitmen, benar-benar punya rasa ingin tahu, dan tertarik pada subjek materi, karena sebaik apa pun materi kelas ini, tidak akan berguna tanpa keseriusan siswa untuk belajar, berlatih, dan mencoba.</span></li><li><span data-sheets-textstyleruns=""î¸î¸"" data-sheets-userformat='{""2"":13185,""3"":{""1"":0},""10"":0,""11"":4,""12"":0,""15"":""Arial"",""16"":9}' data-sheets-value='{""1"":2,""2"":""Target dan Sasaran Siswa\n- Kelas ini ditujukan untuk pemula yang ingin mempelajari dasar pemrograman bahasa Java dengan mengacu pada standar industri.\n- Kelas dapat diikuti oleh siswa yang melek IT sehingga wajib memiliki dan dapat mengoperasikan komputer dengan baik.\n- Kelas ini didesain untuk pemula sehingga tidak ada prasyarat dalam pemahaman pemrograman sebelumnya. Namun, akan lebih baik jika memiliki pengetahuan dasar tentang pemrograman.\n- Siswa harus bisa belajar mandiri, berkomitmen, benar-benar punya rasa ingin tahu, dan tertarik pada subjek materi, karena sebaik apa pun materi kelas ini, tidak akan berguna tanpa keseriusan siswa untuk belajar, berlatih, dan mencoba.\n- Di akhir kelas, siswa dapat membuat program Java dengan menggunakan IDE Intellij Idea atau IDE Online seperti Glot.io atau Replit.""}'>Di akhir kelas, siswa dapat membuat program Java dengan menggunakan IDE Intellij Idea atau IDE Online seperti Glot.io atau Replit.</span></li></ul>";Android,Multi Platform;15;4.86;FUNDAMENTAL;Android Developer;42;79824
80;Memulai Pemrograman dengan Kotlin;"<p>Kotlin merupakan bahasa utama yang digunakan dalam pengembangan Android saat ini. Hal ini karena manfaat yang diberikan seperti ringkas, cepat, dan aman. Selain itu, sifatnya yang interoperability membuat developer bisa beralih dari bahasa Java ke Kotlin dengan cepat. Tak ayal, Google pernah melaporkan hampir 80% dari 1000 aplikasi teratas di Play Store menggunakan Kotlin. Selain pengembangan Android, Kotlin dapat digunakan untuk berbagai macam pengembangan, baik itu server, back-end, maupun website.</p><ul><li>Materi relevan dengan tools dan framework yang banyak dipakai sekarang. </li><li>Dengan menggunakan Kotlin pengembangan aplikasi akan jauh lebih cepat.</li><li>Pengembangan aplikasi menggunakan Kotlin bisa berjalan bersamaan dengan Java dalam satu project.</li><li>Kotlin menjadi bahasa resmi yang direkomendasikan dalam pengembangan Android.</li><li>Kotlin juga dapat digunakan untuk pengembangan platform selain seperti server, back-end, dan website.</li></ul><p><br></p><p><span style=""font-size: 30px>Target dan Sasaran Siswa</span></p><ul><li>Kelas ini ditujukan bagi yang ingin belajar dasar bahasa pemrograman Kotlin dengan mengacu pada standar kompetensi internasional milik Google Developers Authorized Training Partner. </li><li>Kelas dapat diikuti oleh siswa yang melek IT sehingga wajib memiliki dan dapat mengoperasikan komputer dengan baik.</li><li>Kelas ini didesain untuk pemula sehingga tidak ada prasyarat dalam pemahaman pemrograman sebelumnya. Namun lulus dari kelas <a href=""https://www.dicoding.com/academies/237"">Pengenalan ke Dasar Pemrograman (Basic Programming 101)</a> dan <a href=""https://www.dicoding.com/academies/302"">Pengenalan ke Logika Pemrograman (Programming Logic 101)</a> akan mempermudah pembelajaran.</li><li>Siswa harus bisa belajar mandiri, berkomitmen, benar-benar punya rasa ingin tahu, dan tertarik pada subjek materi, karena sebaik apa pun materi kelas ini, tidak akan berguna tanpa keseriusan siswa untuk belajar, berlatih, dan mencoba.</li><li>Di akhir kelas, siswa paham tentang konsep dasar bahasa pemrograman, functional programming, serta object-oriented programming (OOP) dengan menggunakan Kotlin.</li></ul>";Android,Multi Platform;50;4.84;FUNDAMENTAL;Android Developer;132;59240
86;Memulai Pemrograman dengan Python;"<p>Python adalah bahasa pemrograman interpretatif yang dapat digunakan di berbagai platform dengan filosofi perancangan yang berfokus pada tingkat keterbacaan kode dan merupakan bahasa populer yang berkaitan dengan Data Science dan Machine Learning. Keunggulan Python yang bersifat interpretatif juga banyak digunakan untuk prototyping, scripting dalam pengelolaan infrastruktur, hingga pembuatan website berskala besar. Dengan kemudahan Python tersebut, sering dijadikan bahasa pertama untuk belajar pemrograman.</p><ul><li>Bahasa Python menjadi keharusan untuk Anda yang ingin mempelajari dasar-dasar pemrograman, mulai dari scripting, pengolahan data, hingga machine learning.</li><li>Bahasa Python digunakan secara luas dan masuk dalam bahasa pemrograman populer beberapa tahun belakangan.</li><li>Pustaka (library) yang luas, memungkinkan Anda mengembangkan ke bidang-bidang lainnya. Beberapa library atau framework terpopuler data science dan machine learning menggunakan Python antara lain: Scikit-Learn, TensorFlow, PyTorch.</li><li>Bahasa Python memiliki kurva pembelajaran (learning-curve) yang sangat landai, cocok untuk dipelajari sebagai bahasa pemrograman pertama - dengan kemudahan pembacaan dan kemudahan mempelajari sintaksisnya.</li></ul><p><br></p><div class=""dcd-rounded-8 border-gray-300 mt-4 p-3 h-auto""><h4><span data-sheets-userformat='{""2"":13184,""10"":0,""11"":4,""12"":0,""15"":""Arial"",""16"":9}' data-sheets-value='{""1"":2,""2"":""Python adalah bahasa pemrograman interpretatif yang dapat digunakan di berbagai platform dengan filosofi perancangan yang berfokus pada tingkat keterbacaan kode dan merupakan salah satu bahasa populer yang berkaitan dengan Data Science, Machine Learning, dan Internet of Things (IoT). Keunggulan Python yang bersifat interpretatif juga banyak digunakan untuk prototyping, scripting dalam pengelolaan infrastruktur, hingga pembuatan website berskala besar.""}'><span data-sheets-userformat='{""2"":13185,""3"":{""1"":0},""10"":0,""11"":4,""12"":0,""15"":""Arial"",""16"":9}' data-sheets-value='{""1"":2,""2"":""- Bahasa Python menjadi keharusan untuk Anda yang ingin mempelajari dasar-dasar scripting dan pengolahan data atau machine learning.\n- Bahasa Python digunakan secara luas, masuk dalam 3 besar bahasa pemrograman yang digunakan dalam beberapa tahun belakangan.\n- Pustaka (Library) yang luas, memungkinkan Anda mengembangkan ke bidang-bidang lainnya. Beberapa library atau framework terpopuler data science dan machine learning menggunakan Python antara lain: Scikit-Learn, TensorFlow, PyTorch.\n- Bahasa Python memiliki kurva pembelajaran (learning-curve) yang sangat landai, cocok untuk dipelajari sebagai bahasa pemrograman pertama - dengan kemudahan pembacaan dan kemudahan mempelajari sintaksisnya.""}' style=""font-size: 30px>Target dan Sasaran Siswa</span></span></h4><ul><li>Kelas ditujukan bagi pemula yang ingin belajar dasar pemrograman Python dengan mengacu pada standar industri.</li><li>Kelas dapat diikuti oleh siswa yang melek IT sehingga wajib memiliki dan dapat mengoperasikan komputer dengan baik.</li><li>Kelas ini didesain untuk pemula sehingga tidak ada prasyarat khusus dalam pemahaman pemrograman sebelumnya. Namun, memiliki pengetahuan matematika dasar dan logika pemrograman akan mempermudah pembelajaran.</li><li>Siswa harus bisa belajar mandiri, berkomitmen, benar-benar punya rasa ingin tahu, dan tertarik pada subjek materi, karena sebaik apa pun materi kelas ini, tidak akan berguna tanpa keseriusan siswa untuk belajar, berlatih, dan mencoba.</li><li>Di akhir kelas, siswa mampu membuat program dengan Python menggunakan berbagai IDE yang telah dipelajari, seperti Visual Studio Code, Jupyter Notebook, dan Google Colaboratory.</li></ul></div>";Data,Machine Learning;35;4.8;FUNDAMENTAL;Machine Learning Developer;91;111203
